{
  "$schema": "pkg:generic/dermot-obrien/ai-assisted-work/bundle-schema@1.0.0",
  "name": "ai-assisted-work",
  "owner": "dermot-obrien",
  "description": "AI-Assisted Work as a bundle of one standalone Agent Skill, work (work items, activities, tasks and initiatives in plain files), and bin/skills.mjs, the installer for standalone skills from any bundle.",
  "license": "CC-BY-4.0 AND Apache-2.0",
  "homepage": "https://github.com/dermot-obrien/ai-assisted-work",
  "skills": [
    {
      "name": "work",
      "path": "skills/work",
      "version": "3.2.0",
      "purl": "pkg:generic/dermot-obrien/ai-assisted-work/work@3.2.0",
      "requires": [],
      "check": {
        "command": [
          "node",
          "bin/check.mjs"
        ],
        "runtime": "node",
        "description": ".aaw-config.yaml, when present, names work item and initiative paths that resolve, any deliverables_register exists, and coordination, issues and integration_merge hold known values"
      }
    }
  ],
  "ontology": {
    "id": "pkg:generic/dermot-obrien/ai-assisted-work/work-ontology@1.0.0",
    "path": "skills/work/assets/work.schema.json",
    "extends": []
  }
}
